id,created_at,text,likes,in reply to,retweeted
1384129822482329605,2021-04-19 13:00:40,"[interativo] Neste quiz, o ‘Nexo’ desafia seus conhecimentos sobre a eclética produção musical do cantor que comple… https://t.co/BHcJlVT3QY",1,,False
1384114952688922630,2021-04-19 12:01:34,Ministro da Educação nomeou advogada que coordenou curso de pós-graduação descredenciado em 2017. https://t.co/3gZngqrRM1,47,,False
1384099538227523598,2021-04-19 11:00:19,#AcessoLivre | Tribunal de Contas da União e Ministério Público Federal miram ações e omissões do Ministério da Saú… https://t.co/cuWi6EtbAb,22,,False
1383941128047644672,2021-04-19 00:30:51,"@nexopoliticas | Neste vídeo do CPTE (Centro de Pesquisa Transdisciplinar em Educação), o pesquisador Rodrigo Hübne… https://t.co/HZSQLc2kB7",2,nexopoliticas,False
1383926034966278151,2021-04-18 23:30:53,Catálogos de artistas consagrados atrai operadores tradicionais do mercado financeiro. https://t.co/li2zuo4paB,9,,False
1383903278707007492,2021-04-18 22:00:27,"[estante] A convite da seção ‘Favoritos’, o jornalista e cineasta Paulo Junior indica cinco obras sobre a arte de f… https://t.co/RvwKvmlaGW",27,,False
1383888338122276866,2021-04-18 21:01:05,"Até amanhã (19), as #MaisLidasNoNexo entre os assinantes estão com #acessolivre. Leia, compartilhe e experimente no… https://t.co/hquP6REzOb",9,,False
1383873229064863748,2021-04-18 20:01:03,"Envolvido em polêmicas e dezenas de processos, senador volta a ganhar projeção ao gravar Bolsonaro e divulgar conte… https://t.co/9YxdJXgWTI",16,,False
1383842966486151170,2021-04-18 18:00:48,"[especial] No lançamento de obra que resgata a trajetória de personalidades importantes para a história do país, au… https://t.co/5K6jwXpQVV",29,,False
1383827890379186178,2021-04-18 17:00:54,"Até amanhã (19), as #MaisLidasNoNexo entre os assinantes estão com #acessolivre. Leia, compartilhe e experimente no… https://t.co/Qf3hP0TLhD",19,,False
1383812763114299408,2021-04-18 16:00:47,"#AcessoLivre | Defendido pelo presidente Jair Bolsonaro, procedimento experimental foi relacionado a óbitos de paci… https://t.co/8aae8L310u",57,,False
1383797690060865555,2021-04-18 15:00:53,"#NexoArquivo | O ‘Nexo’ conversou com Fernanda Campagnucci, da Open Knowledge Brasil, sobre a importância de acompa… https://t.co/wKxTlbDfsy",9,,False
1383782581703888898,2021-04-18 14:00:51,Esta é a terceira tentativa do governo federal para estabelecer uma instância de coordenação nacional de enfrentame… https://t.co/njmewXt48l,22,,False
1383759804343099399,2021-04-18 12:30:21,"#AcessoLivre | Presidente culpa governadores, Supremo, falta de dinheiro e até fabricantes de vacinas pela má gestã… https://t.co/ihUAvAIPpO",125,,False
1383744895714693121,2021-04-18 11:31:06,"Até amanhã (19), as #MaisLidasNoNexo entre os assinantes estão com #acessolivre. Leia, compartilhe e experimente no… https://t.co/p0VlMh639r",52,,False
1383563605476462594,2021-04-17 23:30:43,Preço do condimento em saquinhos está em alta. Memes na internet ironizam situação. https://t.co/524aUKG4Ya,12,,False
1383540958747258890,2021-04-17 22:00:44,"Inspirado por tuíte de glaciologista, programador criou página para mostrar dinâmica dos blocos de gelo. https://t.co/6EdHjfmtBQ",32,,False
1383525949115834368,2021-04-17 21:01:05,"Até segunda (19), as #MaisLidasNoNexo entre os assinantes estão com #acessolivre. Leia, compartilhe e experimente n… https://t.co/OoBPpXyQUd",12,,False
1383510697380704257,2021-04-17 20:00:29,"[opinião] ‘Precisamos encontrar meios de gritar, mais uma vez, que não queremos só comida, mas também diversão e ar… https://t.co/6o5IgOfBpa",186,,False
1383495751318183938,2021-04-17 19:01:05,@nexopoliticas |  Floresta tropical é a segunda maior do país e está fortemente relacionada com a economia e a hist… https://t.co/Yr4xIck5Uo,4,nexopoliticas,False
1383480460118949889,2021-04-17 18:00:20,"[entrevista] Jornalista e tradutora Rosa Freire D'Aguiar, viúva de Celso Furtado, fala ao 'Nexo' sobre a coletânea… https://t.co/9VBnE35b56",14,,False
1383465404232658947,2021-04-17 17:00:30,Via @gamarevista | Conheça retratos inéditos feitos por Gama e passagens da vida do bailarino morto neste mês https://t.co/t2FZvwDrKK,9,,False
1383450628685398018,2021-04-17 16:01:47,"Governo Biden aumenta pressão para que Bolsonaro encampe agenda ambiental. Para americanos, participação do preside… https://t.co/5WWhXrUqs8",30,,False
1383435352078049284,2021-04-17 15:01:05,"#NexoArquivo | [entrevista] Neste episódio do podcast Cientistas do Brasil que você precisa conhecer, o médico Carl… https://t.co/buDnBPhQkN",20,,False
1383420128470081544,2021-04-17 14:00:35,"[opinião] ‘Bolsonaro só fez reduplicar, de forma despudorada, a vocação genocida do país, confirmando a tese de que… https://t.co/iKfU9hUWrC",42,,False
1383397567271108616,2021-04-17 12:30:56,#AcessoLivre | Parlamentares escolhem Renan Calheiros para cargo-chave. Maioria da comissão não se declara nem gove… https://t.co/LznGdOQmk2,21,,False
1383382317608046598,2021-04-17 11:30:21,"Até segunda (19), as #MaisLidasNoNexo entre os assinantes estão com #acessolivre. Leia, compartilhe e experimente n… https://t.co/9nqyaFTneC",42,,False
1383368047755358215,2021-04-17 10:33:38,"Terça (27), às 17h, @DudaSalabert e Berenice Bento refletem sobre o que dizem as nossas corporalidades no festival… https://t.co/nA7oSSktvq",18,,False
1383206983873003526,2021-04-16 23:53:38,⚡️ A criação e composição da comissão do Senado que vai apurar a atuação do governo na pandemia. A decisão do plená… https://t.co/OKyNybNKpn,11,,False
1383206479990292481,2021-04-16 23:51:38,Pedro Castillo e Keiko Fujimori vão ao segundo turno da disputa no país andino num cenário de instabilidade polític… https://t.co/kbNohNqfHJ,5,NexoJornal,False
1383206478421561347,2021-04-16 23:51:37,Ex-banqueiro derrota candidato de Rafael Correa no segundo turno com promessa de recuperação econômica e acenos a p… https://t.co/C8D9JgLy5C,4,NexoJornal,False
1383206476861292546,2021-04-16 23:51:37,"Maioria dos ministros considera que denúncias contra o petista não demonstraram corrupção direta na Petrobras, o qu… https://t.co/qnXdpocdnv",2,NexoJornal,False
1383206475284238338,2021-04-16 23:51:37,"Hospitais estão perto do colapso por falta de insumos, segundo governos estaduais, que criticam Ministério da Saúde… https://t.co/QlpWgzQIqB",3,NexoJornal,False
1383206473761689604,2021-04-16 23:51:36,"Em março de 2021, o Brasil bateu recorde histórico de óbitos em um único mês. Quatro estados já registram mais víti… https://t.co/Sx8XUzYg8i",2,NexoJornal,False
1383206472218243073,2021-04-16 23:51:36,Comissões de investigação têm que ser criadas se exigências constitucionais forem cumpridas. No caso de processos d… https://t.co/xfMEMI7DkY,1,NexoJornal,False
1383206470624415744,2021-04-16 23:51:35,Analistas da política e do direito ouvidos pelo 'Nexo' falam sobre os rumos da investigação a partir da composição… https://t.co/ranvcMSSvx,2,NexoJornal,False
1383205221887774720,2021-04-16 23:46:38,Recurso permite regredir no tempo e visualizar as consequências de eventos como desmatamento e aquecimento global. https://t.co/42IvbCIsQC,22,,False
1383189920240578562,2021-04-16 22:45:50,#EscuteNaOrelo os #ExtratosDaSemana https://t.co/s77IaY6K9L,3,NexoJornal,False
1383188452871708676,2021-04-16 22:40:00,A criação e composição da comissão do Senado que vai apurar a atuação do governo na pandemia. A decisão do plenário… https://t.co/sign15fJdM,22,,False
1383185933483278349,2021-04-16 22:29:59,"Inscreva-se na nossa newsletter diária noturna #DurmaComEssa, que além do #podcast, traz os principais destaques do… https://t.co/Ru9cuO5ZDj",1,NexoJornal,False
1383185931788763142,2021-04-16 22:29:59,Este #NexoGráfico mostra a evolução de óbitos por #covid19 no mundo até esta sexta-feira (16). Foram 13.196 novas m… https://t.co/7HuYTQrtfw,4,NexoJornal,False
1383185927825207298,2021-04-16 22:29:58,Este #NexoGráfico mostra a evolução de óbitos por #covid19 no Brasil até esta sexta-feira (16). A média móvel foi d… https://t.co/rZ502RhL3E,12,,False
1383185356372205568,2021-04-16 22:27:41,RT @nexopoliticas: ⚡️ Sistemas alimentares e pandemia. Mata Atlântica e  mudança do clima. Judicialização da política. E mais destaques da…,0,,False
1383171153615814656,2021-04-16 21:31:15,"[estante] O ‘Nexo’ publica trecho de livro sobre a vida de Roberto Carlos, lançado no ano em que o cantor completa… https://t.co/xjB90y13dl",8,,False
1383158659212046340,2021-04-16 20:41:36,[profissões] A tenente Tatiana Lima faz parte da pequena porcentagem de mulheres no efetivo da Polícia Militar. Ela… https://t.co/EAAjcF2r6c,17,,False
1383136563832492039,2021-04-16 19:13:48,@brunstwice Boa tarde! Você pode tentar novamente? O acesso ao texto está liberado,0,brunstwice,False
1383132859154759691,2021-04-16 18:59:05,[expresso] Novas regras e restrições rigorosas marcam principalmente condições de deslocamento de viajantes que pas… https://t.co/Sb0hcgPfai,5,,False
1383110745563480070,2021-04-16 17:31:13,"Homem armado mata 8 em Indianápolis, no 21º incidente do tipo em um mês. Biden tenta restringir comércio de armas,… https://t.co/yPDosFWKSh",24,,False
1383095783206088705,2021-04-16 16:31:46,[entrevista] Historiador peruano Antonio Zapata fala ao 'Nexo' sobre a encruzilhada entre Pedro Castillo e Keiko Fu… https://t.co/Lx1Oe8wro2,8,,False
1383080417713065986,2021-04-16 15:30:42,#NexoArquivo | [estante] O cofundador e editor-chefe da agência de jornalismo Alma Preta indica cinco livros para e… https://t.co/YVRmUcu7tv,30,,False
1383065277684973573,2021-04-16 14:30:32,Irregularidades nos repasses ao programa de crédito rural embasaram impeachment de Dilma Rousseff em 2016 e voltam… https://t.co/NmYbh7yl4V,10,,False
1383042638627147778,2021-04-16 13:00:35,"#AcessoLivre | Hospitais estão perto do colapso por falta de insumos, segundo governos estaduais, que criticam Mini… https://t.co/z4E5UisEgy",12,,False
1383027619097108485,2021-04-16 12:00:54,[opinião] ‘O nosso contexto político é o que impede a ‘Bidenomics’ de tornar-se uma inspiração para o enfrentamento… https://t.co/PEbgBoWCv3,113,,False
1383012399268167686,2021-04-16 11:00:25,"Maioria dos ministros considera que denúncias contra o petista não demonstraram corrupção direta na Petrobras, o qu… https://t.co/c94YByJ9Cx",18,,False
1382853837904564224,2021-04-16 00:30:21,"Idealizado por Cláudio Moreno, ‘Noites gregas’ aborda diversos aspectos mitológicos em episódios quinzenais. https://t.co/AMTCttQwCd",85,,False
1382848661156208644,2021-04-16 00:09:47,"RT @gamarevista: Toda semana uma curadoria do que há de bom por aí, nas artes e na vida. Segue a thread para ver as dicas desta semana 🧵
ht…",0,,False
1382838919734124545,2021-04-15 23:31:05,"#AcessoLivre | Mais de um ano depois do início da crise que turbinou a lista de tarefas dentro de casa, elas relata… https://t.co/in3sXX7Ykn",22,,False
1382828112308805632,2021-04-15 22:48:08,[podcast] Médicos Sem Fronteiras afirma que Brasil vive catástrofe sanitária e representa uma ameaça à saúde global… https://t.co/AoMYPZYoKo,70,,False
1382823769924861955,2021-04-15 22:30:53,Maioria dos ministros do Supremo apoia decisão de Edson Fachin e consolida caminho para candidatura de ex-president… https://t.co/HYRkvM4GyG,31,,False
1382805844367175681,2021-04-15 21:19:39,"Inscreva-se na nossa newsletter diária noturna #DurmaComEssa, que além do #podcast, traz os principais destaques do… https://t.co/MIRxqc1lsb",1,NexoJornal,False
1382805842584600577,2021-04-15 21:19:38,Este #NexoGráfico mostra a evolução de óbitos por #covid19 no mundo até esta quinta-feira (15). Foram 13.529 novas… https://t.co/TS5MQ3d505,3,NexoJornal,False
1382805838688104450,2021-04-15 21:19:37,Este #NexoGráfico mostra a evolução de óbitos por #covid19 no Brasil até esta quinta-feira (15). A média móvel foi… https://t.co/KG4Vv64vQM,13,,False
1382793683339247617,2021-04-15 20:31:19,Agência Pública acessou processos judiciais e ouviu mulheres que dizem ter sido vítimas de Samuel Klein quando tinh… https://t.co/rM3SEHnKPj,40,,False
1382786149274517511,2021-04-15 20:01:23,"RT @gamarevista: No #DiaMundialDaArte relembre conteúdos da Gama que refletem, dialogam e exploram o assunto. Segue a thread 🧵",0,,False
1382778456673558532,2021-04-15 19:30:49,Via @gamarevista | O advogado Joel Luiz tem escritório na favela do Jacarezinho e muitas ideias para transformar o… https://t.co/uZ42cFJoxn,37,,False
1382766632615952387,2021-04-15 18:43:50,"[opinião] ‘Sem pensar nos incentivos existentes dentro do sistema democrático e em como agradar os eleitores hoje,… https://t.co/DFQHr4nywM",28,,False
1382757308346798086,2021-04-15 18:06:47,"RT @nexopoliticas: Neste 'bibliografia básica', conteúdo produzido em parceria com a @BPBES_oficial, a professora da UFSCar @AgostiniKayna…",0,,False
1382748345018499073,2021-04-15 17:31:10,"#AcessoLivre | [gráfico] Em março de 2021, o Brasil bateu recorde histórico de mortes em um único mês. Quatro estad… https://t.co/CwR0O1xJQk",8,,False
1382738366572138498,2021-04-15 16:51:31,"#AcessoLivre | Países que foram modelo no início da pandemia agora amargam piora nos indicadores, com vacinação len… https://t.co/j67zws0gGO",12,,False
1382735109124730881,2021-04-15 16:38:34,"RT @nexopoliticas: Neste vídeo do CPTE (Centro de Pesquisa Transdisciplinar em Educação), o pesquisador Rodrigo Hübner Mendes explica por q…",0,,False
1382718056305147906,2021-04-15 15:30:48,"#NexoArquivo | [podcast] Nesta edição, a história das CPIs no Brasil. E como elas perderam sua eficácia https://t.co/clHjhn52G9",18,,False
1382702842197258245,2021-04-15 14:30:21,"[acadêmico] Esta dissertação, realizada por Felipe Lauritzen na Sciences Po Paris, verifica estatisticamente as con… https://t.co/wDTUzfY4Xj",12,,False
1382680367195361287,2021-04-15 13:01:03,"Aumento de preços afeta com mais força as faixas de renda mais altas no início do ano, na comparação com 2020. Impa… https://t.co/Z8cqKTdSZd",7,,False
1382665172540665859,2021-04-15 12:00:40,#AcessoLivre | Medicamentos como cloroquina e ivermectina continuam a ser receitados e defendidos por políticos com… https://t.co/7a9CawWkQQ,39,,False
1382650132194295808,2021-04-15 11:00:54,Ministros avaliam decisão de Edson Fachin que anulou condenações da Lava Jato. Suspeição de Sergio Moro decretada p… https://t.co/xzvIyfgfTv,16,,False
1382596298528935937,2021-04-15 07:26:59,"Produzido por Roberto Menescal, disco de 1972 mostra cantora modernizando sonoridade e repertório. https://t.co/EJ5rQwFRdV",33,,False
1382476373009297413,2021-04-14 23:30:27,#NexoArquivo | [gráfico] Entenda como utilizar cada técnica e o que é necessário saber sobre a temperatura da água… https://t.co/RClJx441oJ,74,,False
1382461314845581317,2021-04-14 22:30:37,"Premiação chega em sua 68ª edição em 2021, popularizando ainda mais a fantasia e a ficção científica.  https://t.co/oV85n5J0vu",14,,False
1382457917249622017,2021-04-14 22:17:06,Escute o podcast #DurmaComEssa na Orelo ☁️🎧 https://t.co/iAWp7wkTJY,1,NexoJornal,False
1382451146602778629,2021-04-14 21:50:12,"[podcast] Bernie Madoff estava preso desde 2008 por um esquema de pirâmide envolvendo US$ 65 bilhões, o maior já re… https://t.co/DOvqWVU2fb",23,,False
1382447412975915009,2021-04-14 21:35:22,"Inscreva-se na nossa newsletter diária noturna #DurmaComEssa, que além do podcast, traz os principais destaques do… https://t.co/5WdLyxknse",1,NexoJornal,False
1382447411210108933,2021-04-14 21:35:22,Este #NexoGráfico mostra a evolução de óbitos por covid-19 no mundo até esta quarta-feira (14). Foram 13.331 novas… https://t.co/FoyJZ3UMHl,4,NexoJornal,False
1382447407204536322,2021-04-14 21:35:21,Este #NexoGráfico mostra a evolução de óbitos por covid-19 no Brasil até esta quarta-feira (14). A média móvel foi… https://t.co/6HvFLllSSa,24,,False
1382434783133843456,2021-04-14 20:45:11,"[opinião] ‘A corrupção é areia nas engrenagens de políticas afirmativas que buscam promover a igualdade de gênero,… https://t.co/PcFzqm8Mj1",9,,False
1382416182016348164,2021-04-14 19:31:16,Empresa anuncia aquisição de grupo focado em cobertura de cultura pop. Varejista também já comprou sites de tecnolo… https://t.co/0obXVBCWSj,46,,False
1382400933401870339,2021-04-14 18:30:40,"[gráfico] Em 2017, cerca de 5,5% dos jovens brasileiros entre 13 e 15 anos fumavam. Na maioria dos países, a porcen… https://t.co/2q5V0DZI2t",9,,False
1382388102132563980,2021-04-14 17:39:41,"RT @nexopoliticas: “Política pública de primeira infância pioneira no Brasil, o Primeira Infância Melhor serviu de inspiração para programa…",0,,False
1382385971560386562,2021-04-14 17:31:13,"Depois de 20 anos de uma guerra que custou US$ 800 bilhões e deixou mais de 100 mil civis mortos e feridos, EUA fix… https://t.co/9MsIqUcFwr",17,,False
1382370704516087810,2021-04-14 16:30:33,Comissões de investigação têm que ser criadas se exigências constitucionais forem cumpridas. No caso de processos d… https://t.co/ARMAutipMZ,5,,False
1382355760236093443,2021-04-14 15:31:10,"#NexoArquivo | [podcast] Neste ‘Politiquês’, uma conversa sobre colegiados fundamentais na aprovação ou no veto de… https://t.co/LaaeaPFG1J",6,,False
1382340607838990336,2021-04-14 14:30:58,Botijão e gás encanado ficam mais caros e pressionam bolso dos brasileiros. Movimento do preço vai na contramão de… https://t.co/YyZXGzBCVY,28,,False
1382317888309239818,2021-04-14 13:00:41,[opinião] ‘Emenda constitucional e decreto inauguram nova etapa para a educação infantil no país: com mais recursos… https://t.co/lGpSYEbO8h,18,,False
1382302867646734337,2021-04-14 12:01:00,"#AcessoLivre | Cinco dias após ordem do Supremo, Senado oficializa comissão. Presidente da Casa unificou pedidos de… https://t.co/g7qK0BQXro",3,,False
1382287617723666433,2021-04-14 11:00:24,#AcessoLivre | Estudo conduzido no fim de 2020 mapeou a parcela dos lares brasileiros que enfrenta fome ou acesso i… https://t.co/aCCutHq3E6,20,,False
1382122029533564938,2021-04-14 00:02:25,Políticos e personalidades costumam receber honraria. Alguns nomes escolhidos são motivos de controvérsia. https://t.co/oQQ0IO5c93,21,,False
1382110820507717637,2021-04-13 23:17:52,Descolamento do leito marinho pode dar início a série de eventos que aumentariam nível do mar em mais de três metro… https://t.co/E6K4eXtEmr,23,,False
1382096111289139201,2021-04-13 22:19:25,"Inscreva-se na nossa newsletter diária noturna #DurmaComEssa, que além do podcast, traz os principais destaques do… https://t.co/WO4i4Pw4tC",2,NexoJornal,False
1382096109443682305,2021-04-13 22:19:25,Este #NexoGráfico mostra a evolução de óbitos por covid-19 no mundo até esta terça-feira (13). Foram 9.293 novas mo… https://t.co/CzjOTa9yV7,6,NexoJornal,False
1382096105471627265,2021-04-13 22:19:24,Este #NexoGráfico mostra a evolução de óbitos por covid-19 no Brasil até esta terça-feira (13). A média móvel foi d… https://t.co/ARYeJXltDg,4,NexoJornal,False
1382096104200753159,2021-04-13 22:19:24,"A partir de hoje, 13/04, o gráfico de óbitos por covid-19 no Brasil passa a utilizar o CONASS (Conselho Nacional de… https://t.co/a0lpl1tmGY",35,,False
1382094877018718222,2021-04-13 22:14:31,"O fundador do Twitter,  @jack, vendeu o primeiro tuíte publicado na plataforma por US$ 2,9 milhões, quase R$ 16 mil… https://t.co/aqOqmuqRh6",11,,False
1382084175419834374,2021-04-13 21:31:59,"“A mudança é coletiva. Todo mundo tem um papel central” - Aparecida Vilaça agora no festival #QuandoComeçaOSéculo21
https://t.co/acukZ9Dpr4",4,NexoJornal,False
1382083790168850434,2021-04-13 21:30:28,"[podcast] Segundo Ministério da Saúde, 1,5 milhão de pessoas não voltaram para a segunda aplicação. Abandono vacina… https://t.co/gxyZ52aeM9",18,,False
1382083166740094985,2021-04-13 21:27:59,"""Não se pode desvincular a ciência do bem-estar"" Aparecida Vilaça agora no festival #QuandoComeçaOSéculo21
https://t.co/acukZ9Dpr4",6,NexoJornal,False
1382076026587598852,2021-04-13 20:59:37,"Depois de trocar quatro vezes de presidente em três anos, Peru busca estabilidade em candidatos de polos extremos e… https://t.co/AtxoCDOhC3",7,,False
1382072719508959241,2021-04-13 20:46:28,“Não haveria de ter dentro desse campo da espécie humana um conjunto de pessoas socioambientais. Nós todos temos qu… https://t.co/ydin6aPGzk,6,NexoJornal,False
1382070122387443713,2021-04-13 20:36:09,"“Enquanto o céu está azul, as corporações comem a Terra” - Ailton Krenak agora no festival #QuandoComeçaOSéculo21
https://t.co/acukZ9lO2u",28,NexoJornal,False
1382066899132026881,2021-04-13 20:23:20,"“Entre a extinção e a peste, eu ficaria na dúvida” - Ailton Krenak agora no festival #QuandoComeçaOSéculo21
https://t.co/acukZ9Dpr4",14,NexoJornal,False
1382063345151410179,2021-04-13 20:09:13,"RT @ANPOCS: Em parceria com o @NexoJornal promovemos entre março e junho o festival #QuandoComeçaOSéculo21? 

Encontros virtuais entre cien…",0,,False
1382061997328519168,2021-04-13 20:03:52,Emergências climáticas: somos uma espécie em extinção? https://t.co/yX9NR11OQt,101,,False
1382056211105906691,2021-04-13 19:40:52,"#NexoArquivo | [especial] Áreas de convívio unindo prédios e calçadas, iluminação pública de led, mais espaço para… https://t.co/LulCI1VFSU",16,,False
1382042149634646017,2021-04-13 18:45:00,"Daqui a pouco, às 17h, Ailton Krenak e Aparecida Vilaça refletem se somos uma espécie humana em extinção na mesa “E… https://t.co/0ygRTAokN6",7,,False
1382038684766208004,2021-04-13 18:31:14,"Gestão de mídias sociais lidera a lista de 15 ocupações com maior expansão desde 2015, indica um levantamento do Li… https://t.co/yw6BNL6YPk",22,,False
1382031815146373120,2021-04-13 18:03:56,"@jfotxt Oi, Jefferson! Na manhã desta terça (13), nosso site passou por uma instabilidade no acesso ao login e o me… https://t.co/XSqDsgTN72",1,jfotxt,False
1382031632601866240,2021-04-13 18:03:12,"@viniciusbarros Oi, Vinícius! Na manhã desta terça (13), nosso site passou por uma instabilidade no acesso ao login… https://t.co/CBxBgInywg",1,viniciusbarros,False
1382023408611901441,2021-04-13 17:30:32,Decisão liminar de ministra suspende efeitos de quatro medidas que flexibilizavam a compra e o porte de armas no Br… https://t.co/HxtkuoINOg,26,,False
1382019977453142018,2021-04-13 17:16:53,"RT @nexopoliticas: O microcrédito tornou-se relevante no debate internacional no fim dos anos 1970, quando Muhammad Yunus criou o Banco Gra…",0,,False
1382015997708734473,2021-04-13 17:01:05,"Daqui a pouco, às 17h, Ailton Krenak e Aparecida Vilaça refletem se somos uma espécie humana em extinção na mesa “E… https://t.co/dZnJ9AH4AV",18,,False
1382010516542005254,2021-04-13 16:39:18,#AcessoLivre | Analistas da política e do direito ouvidos pelo 'Nexo' falam sobre os rumos da investigação a partir… https://t.co/fDUuAmvkSw,8,,False
1381993413017530372,2021-04-13 15:31:20,Via @gamarevista | Nossas refeições nunca estiveram tão embaralhadas. E dificilmente voltarão a ser tão regradas co… https://t.co/kmt8EkuMtl,15,,False
1381978138834579456,2021-04-13 14:30:38,"Com protagonismo do ministro Tarcísio de Freitas, governo concede 28 projetos para a iniciativa privada. Apesar do… https://t.co/7JnUBXp4JB",11,,False
1381955462292201477,2021-04-13 13:00:32,#AcessoLivre | Informações sobre a eficácia e os efeitos colaterais dos imunizantes Oxford/AstraZeneca e Coronavac… https://t.co/c13q4GsHSk,5,,False
1381940415268589569,2021-04-13 12:00:44,[opinião] ‘Não se cria e mantém uma lei quando inexiste a intenção de burlá-la. O presidente que o diga.’ Leia na c… https://t.co/dEgcrKsBac,32,,False
1381925321931374597,2021-04-13 11:00:46,#AcessoLivre | O que mudou e o que não mudou nos prognósticos desde o início da pandemia. https://t.co/K93KuoWY7K,8,,False
1381766756855857154,2021-04-13 00:30:41,"Amanhã (13), às 17h, Ailton Krenak e Aparecida Vilaça refletem se somos uma espécie humana em extinção na mesa “Eme… https://t.co/MDf269zGu6",30,,False
1381753653241995268,2021-04-12 23:38:37,#AcessoLivre | Obra mostra estruturas vazias e situação de profissionais dos clubes que estão sem funcionar desde m… https://t.co/q0I6tB7gpQ,15,,False
1381749314943393793,2021-04-12 23:21:23,"Inscreva-se na nossa newsletter diária noturna #DurmaComEssa, que além do podcast, traz os principais destaques do… https://t.co/GRykaJB5oF",5,NexoJornal,False
1381749313190117377,2021-04-12 23:21:22,Este #NexoGráfico mostra a evolução de óbitos por covid-19 no mundo até esta segunda-feira (12). Foram 8.553 novas… https://t.co/WC6DQgXwCV,9,NexoJornal,False
1381749309184544770,2021-04-12 23:21:21,Este #NexoGráfico mostra a evolução de óbitos por covid-19 no Brasil até esta segunda-feira (12). A média móvel foi… https://t.co/tTjUNUpKq8,30,,False
1381742041470795778,2021-04-12 22:52:28,[podcast] Medida altera mais de 50 regras do Código Brasileiro de Trânsito. Flexibilização de pontos para suspensão… https://t.co/6HtE6sX6d3,12,,False
1381731968665128961,2021-04-12 22:12:27,Governo anuncia regularização de programa que permite que usuários avaliem substâncias ilegais como ecstasy e LSD e… https://t.co/6j9ZjY2zMI,77,,False
