id,created_at,text,likes,in reply to,retweeted
1358415395703689219,2021-02-07 14:00:43,[opinião] ‘As questões acerca da grave e preocupante situação ambiental no planeta devem estar enraizadas já no iní… https://t.co/CWltHmn3JU,30,,False
1358392733002522625,2021-02-07 12:30:39,[entrevista] O ‘Nexo’ conversou com o cientista político Leonardo Avritzer sobre a conjuntura política criada para… https://t.co/O5wf3UNZRF,15,,False
1358377768615112704,2021-02-07 11:31:12,"Aos finais de semana, recuperamos em nossas redes sociais as #MaisLidasNoNexo entre os assinantes. Este conteúdo es… https://t.co/WklobraDvc",9,,False
1358211574750732291,2021-02-07 00:30:48,"Aos finais de semana, recuperamos em nossas redes sociais as #MaisLidasNoNexo entre os assinantes. Este conteúdo es… https://t.co/pcwmboaYpo",27,,False
1358196371262685187,2021-02-06 23:30:23,Site reúne artes do mais importante ilustrador de Hollywood. https://t.co/LJFPQUTErO,18,,False
1358173998023065606,2021-02-06 22:01:29,"Nos anos 1960, liga concorrente ameaçou o domínio da NFL e ajudou a moldar a grande final do futebol americano. https://t.co/Xi4qjDJXZ1",8,,False
1358158737459077120,2021-02-06 21:00:51,"#NexoArquivo |  [vídeo]  Naércio Menezes Filho, professor do Insper e da USP, e a Márcia Lima, professora da USP, d… https://t.co/ScUJtAbB7J",32,,False
1358144528532852737,2021-02-06 20:04:23,"RT @gamarevista: O cancelamento é uma das coisas que o diretor do Teatro Oficina,  Zé Celso, mais detesta. Veja todas as respostas do drama…",0,,False
1358143595916783620,2021-02-06 20:00:41,[opinião] ‘As leis cegas da economia não preveem o retumbante contrassenso de um país com extensão territorial supe… https://t.co/tT8J0Ip6eo,25,,False
1358143519987228681,2021-02-06 20:00:22,RT @nexopoliticas: Toda semana trazemos uma sequência com conteúdos de nossos centros de pesquisa parceiros sobre temas fundamentais para o…,0,,False
1358143505198157827,2021-02-06 20:00:19,"RT @nexopoliticas: ⚡️ #VacinaSim. Conservação da Amazônia. E outros destaques #NexoPolíticasPúblicas

https://t.co/J9fInHyQUq",0,,False
1358128519755227137,2021-02-06 19:00:46,"Aos finais de semana, recuperamos em nossas redes sociais as #MaisLidasNoNexo entre os assinantes. Este conteúdo es… https://t.co/0erQByRrlq",5,,False
1358113571486523392,2021-02-06 18:01:22,"Responsável por clássicos do terror e da ficção científica, cineasta se distancia do cinema e lança álbum com cançõ… https://t.co/dwzdj3UQKD",20,,False
1358098255620562945,2021-02-06 17:00:31,Via @gamarevista | Especialistas explicam como e por que a prática de esportes pode ajudar no tratamento de transto… https://t.co/JLo65R9lou,16,,False
1358083251571720193,2021-02-06 16:00:53,Caso tem disputa em torno do acesso de Lula a arquivos de conversas entre autoridades da Lava Jato. Se sair vitorio… https://t.co/eEmjGptK75,15,,False
1358068336958070786,2021-02-06 15:01:37,"#NexoArquivo | [serviço] Melão, abacate, limão, maçã e manga. Você sabe identificar o ponto ideal para o consumo de… https://t.co/6xX4DuVjPG",23,,False
1358053043179167752,2021-02-06 14:00:51,[opinião] ‘Não podemos ficar reféns das indústrias farmacêuticas. A imunização deve ser para todos. É preciso estab… https://t.co/HGW9swGkvm,83,,False
1358030434182066176,2021-02-06 12:31:01,"Capital fluminense ultrapassou no início de fevereiro de 2021 número de óbitos de São Paulo, que tem quase o dobro… https://t.co/AvriINf5Qs",44,,False
1358015255524343808,2021-02-06 11:30:42,"Aos finais de semana, recuperamos em nossas redes sociais as #MaisLidasNoNexo entre os assinantes. Este conteúdo es… https://t.co/bEWRHm068H",27,,False
1357856647188795394,2021-02-06 01:00:27,Gigantes americanas de tecnologia têm ganhos elevados em ano marcado pela crise sanitária e pelas pressões por maio… https://t.co/alsm3xOiLG,10,,False
1357849136947732481,2021-02-06 00:30:36,#NexoPolíticasPúblicas | Contingenciar despesas significa contingenciar a ação do Estado frente às demandas e neces… https://t.co/XKvN3C9UDA,9,,False
1357841511162015748,2021-02-06 00:00:18,"Mais de cinco décadas depois, gravadora lança canção lírica que foi encomendada por diretor a publicitário que era… https://t.co/3lzUDa9deU",16,,False
1357833981060866050,2021-02-05 23:30:23,"Conjunto criou maneira acessível de compor, tocar e entender música por meio da percussão corporal. Criador morreu… https://t.co/nvSuBEutaJ",39,,False
1357826670149988352,2021-02-05 23:01:20,Novos presidentes da Câmara e do Senado dão sinais favoráveis às pautas defendidas pelo ministro da Economia. O ‘Ne… https://t.co/9jjfATp2NQ,11,,False
1357818781893033985,2021-02-05 22:29:59,Missão arqueológica no Egito apresentou objetos que fariam parte de feitiço para conversar com deus em vida após a… https://t.co/HiM1Y739yc,16,,False
1357811418431688709,2021-02-05 22:00:43,"Cineasta conhecido por animações faz sua estreia na Netflix com ‘Cidade invisível’, produção que quer levar lendas… https://t.co/ccDpPTcSZh",55,,False
1357808963530747904,2021-02-05 21:50:58,⚡️ A eleição para as presidências da Câmara e do Senado. A vitória de candidatos apoiados pelo governo Bolsonaro. A… https://t.co/SNv6HHYE7o,19,,False
1357808211475185665,2021-02-05 21:47:59,Militares prendem líder do movimento democrático e decretam lei de exceção por um ano após invalidar eleições parla… https://t.co/sp93u5mdvF,19,NexoJornal,False
1357808210028204035,2021-02-05 21:47:58,"Após processo movido pelo governo de Minas, Vale promete pagar R$ 37,7 bilhões em auxílios e obras. Atingidos dizem… https://t.co/EuGv79WuiY",21,NexoJornal,False
1357808208518270976,2021-02-05 21:47:58,"Força-tarefa da cidade em que operação começou é encerrada, num momento de declínio do modelo e expectativa quanto… https://t.co/YaJgzFfRLw",14,NexoJornal,False
1357808206987341835,2021-02-05 21:47:58,Agência federal derrubou exigência de testes realizados em voluntários brasileiros. Políticos tentam conseguir mais… https://t.co/Q7H9CEXMS8,11,NexoJornal,False
1357808205473210370,2021-02-05 21:47:57,Novos presidentes da Câmara e do Senado dão sinais favoráveis às pautas defendidas pelo ministro da Economia. O ‘Ne… https://t.co/zWiXP6ApP5,12,NexoJornal,False
1357808203959046149,2021-02-05 21:47:57,Parlamentar por Minas vence com apoio de Bolsonaro e também de partidos da oposição. Mandato é de dois anos… https://t.co/U0juZugFct,12,NexoJornal,False
1357808202381934595,2021-02-05 21:47:56,"Apoiado pelo governo, deputado será o responsável por colocar a agenda do Planalto em pauta e analisar pedidos de i… https://t.co/j6s3eso2Wa",30,NexoJornal,False
1357803686186131460,2021-02-05 21:30:00,A eleição para as presidências da Câmara e do Senado. A vitória de candidatos apoiados pelo governo Bolsonaro. As m… https://t.co/K9xKHwfEFy,96,,False
1357796287261913093,2021-02-05 21:00:36,#AcessoLivre | Refugiar-se numa ilha deserta sempre foi programa para um nicho minúsculo e muito privilegiado da po… https://t.co/rwX2jQGNqa,4,,False
1357792857076207625,2021-02-05 20:46:58,"Escrita por Brian Herbert e Kevin J. Anderson, adaptação do livro de 1965 acaba de chegar ao Brasil. https://t.co/7gSjUkwvs4",31,,False
1357773638628487170,2021-02-05 19:30:36,Via @gamarevista | Falta de rumo na condução da pandemia poderia ser revertida com atenção aos dados atuais e à exp… https://t.co/2lj3eUCRZI,14,,False
1357758662564003844,2021-02-05 18:31:05,"Biden reformula a política externa de Trump. Apoio à Arábia Saudita deixa de ser incondicional, mas tensão com Rúss… https://t.co/yrRy2N2f4b",4,,False
1357745790547079174,2021-02-05 17:39:56,"Líderes das maiores comunidades do Brasil lançam banco com capital inicial de R$ 1,8 milhão para ajudar moradores. https://t.co/n86g10GwDS",26,,False
1357743087406243842,2021-02-05 17:29:12,"@NewScavazzini @1iversoDiscreto @folha Olá, Newton! Desculpe o inconveniente. Por favor nos envie seu e-mail via DM… https://t.co/26LdKxk9bX",0,NewScavazzini,False
1357740153222094852,2021-02-05 17:17:32,"@felipevanderson Olá, Felipe! Por favor, nos envie uma mensagem privada com o seu e-mail.",0,Fevanderson_,False
1357728420030017538,2021-02-05 16:30:55,[estante] O ‘Nexo’ publica trecho de romance que resgata exemplos da história do esporte para questionar as narrati… https://t.co/6qUtMMhR73,5,,False
1357713276310847488,2021-02-05 15:30:44,"#NexoArquivo | Conteúdos para diminuir o ritmo, aprender e expandir seus horizontes informativos. https://t.co/pfyN3V4MFs",27,,False
1357698105865621504,2021-02-05 14:30:27,#AcessoLivre | Refugiar-se numa ilha deserta sempre foi programa para um nicho minúsculo e muito privilegiado da po… https://t.co/87yEcL9QdT,18,,False
1357675485195628547,2021-02-05 13:00:34,Gigantes americanas de tecnologia têm ganhos elevados em ano marcado pela crise sanitária e pelas pressões por maio… https://t.co/E1YvlG18O9,9,,False
1357660452247986176,2021-02-05 12:00:50,"[opinião] ‘É provável que fiquemos mesmo sem rumo de política econômica até 2022. Nesse cenário, Bolsonaro manteria… https://t.co/X1e2lrKAvJ",160,,False
1357645493665484802,2021-02-05 11:01:24,#AcessoLivre | Agência federal derrubou exigência de testes realizados em voluntários brasileiros. Políticos tentam… https://t.co/2dZYA9HW1I,7,,False
1357494303233294337,2021-02-05 01:00:37,Agência brasileira quer realizar leilão sem avaliação ambiental. Impactos ocorrem mesmo que não haja acidentes. https://t.co/FBT3KBPnwJ,24,,False
1357486833714757634,2021-02-05 00:30:56,"#NexoPolíticasPúblicas | Mesmo com a crise sanitária e pouca coordenação do Ministério da Educação, reforma do ensi… https://t.co/WJ08PTA0yl",8,,False
1357479191298641920,2021-02-05 00:00:34,"PSL indica Bia Kicis, negacionista científica investigada pelo Supremo, para presidir comissão mais importante da C… https://t.co/UPQCRNNLox",29,,False
1357471700116533252,2021-02-04 23:30:48,"Cineasta conhecido por animações faz sua estreia na Netflix com ‘Cidade invisível’, produção que quer levar lendas… https://t.co/SZIRQbjCB2",63,,False
1357464183470772224,2021-02-04 23:00:56,"[estante] O ‘Nexo’ publica trecho de livro que relata, em primeira pessoa, as torturas e as condições de vida sub-h… https://t.co/tJ3WBnf08i",20,,False
1357460904745586690,2021-02-04 22:47:54,"Saudação de três dedos levantados, que já foi usada por manifestantes em Hong Kong e Tailândia, indica ‘resistência… https://t.co/OgiPiikAzn",60,,False
1357458190657609728,2021-02-04 22:37:07,"RT @gamarevista: Toda semana uma curadoria do que há de bom por aí, nas artes e na vida. Segue a thread para ver as dicas desta semana 👇
ht…",0,,False
1357449218722582529,2021-02-04 22:01:28,"Estudo com 438 espécies indica que a longevidade média de exemplares de clima quente e de áreas frias é, respectiva… https://t.co/nzwleRjjIN",30,,False
1357445419274543108,2021-02-04 21:46:22,"Inscreva-se na nossa newsletter diária noturna #DurmaComEssa, que além do podcast, traz os principais destaques do… https://t.co/FGzegONdvw",0,NexoJornal,False
1357445417538060290,2021-02-04 21:46:22,Este #NexoGráfico mostra a evolução de óbitos em decorrência da covid-19 confirmados no mundo até esta quinta-feira… https://t.co/oG3NXBo712,5,NexoJornal,False
1357445413830336518,2021-02-04 21:46:21,Este #NexoGráfico mostra a evolução de óbitos em decorrência da covid-19 confirmados no Brasil até esta quinta-feir… https://t.co/PF8X2GJzPY,17,,False
1357441694069907459,2021-02-04 21:31:34,"RT @gamarevista: Se controlar a ansiedade tem sido uma tarefa difícil, respire fundo e leia essas sugestões valiosas
https://t.co/a22rdpt9BX",0,,False
1357441433242845193,2021-02-04 21:30:32,"[acadêmico] Esta tese, elaborada por Leonardo Nóbrega, na Uerj, dá destaque ao papel que editoras como a Zahar cump… https://t.co/fihW0942GZ",16,,False
1357434045743955974,2021-02-04 21:01:11,[opinião] ‘Não precisamos ser disruptivos e complexos. Existe um custo ambiental para produzir nesse planeta e devo… https://t.co/8h2WNpsDI4,7,,False
1357429801615831042,2021-02-04 20:44:19,"[podcast] Após processo movimento pelo governo de Minas, Vale promete pagar 37,7 bilhões em auxílios e obras. Ating… https://t.co/510b1sUTPX",6,,False
1357416722869985288,2021-02-04 19:52:20,RT @gamarevista: Professor @DanielBShapiro de #Harvard que ensina negociação para lideranças mundiais fala a #GamaRevista sobre como podemo…,0,,False
1357411314700853251,2021-02-04 19:30:51,"#NexoArquivo | [podcast] Bolsonaros, Maias, Magalhães, Ferreira Gomes, Sarneys, etc, etc etc. Eles são o tema deste… https://t.co/viIBJQzQ1x",28,,False
1357396186148274176,2021-02-04 18:30:44,"[gráfico] Produtor histórico, o estado de Minas Gerais responde por 27,1% do leite brasileiro. Cidades de colonizaç… https://t.co/D6STk0wMtJ",3,,False
1357381179373158407,2021-02-04 17:31:06,O economista Draghi foi escolhido para liderar um novo governo na Itália por causa de seu perfil técnico. Mas ningu… https://t.co/MMXAmxHU4l,14,,False
1357375567243403264,2021-02-04 17:08:48,RT @nexopoliticas: Estudo mostra que a maioria dos estados e capitais demorou para adotar planos de ensino remoto e fez investimentos limit…,0,,False
1357366064707960834,2021-02-04 16:31:03,Agência brasileira quer realizar leilão sem avaliação ambiental. Impactos ocorrem mesmo que não haja acidentes. https://t.co/gFS89jWjEK,14,,False
1357366002892365830,2021-02-04 16:30:48,"@longueettenue @diplobrasil Olá. Você está enfrentando algum problema? Por favor, nos envie uma mensagem privada explicando o que aconteceu.",0,longueettenue,False
1357351104850370560,2021-02-04 15:31:36,"#NexoArquivo | [léxico] Na tradição cristã ela é bem forte. Imputada por alguém ou autoinfligida, ela gera um senti… https://t.co/DyaS3wZ5He",22,,False
1357335761842888706,2021-02-04 14:30:38,"[opinião] ‘Em tempos normais, pode ser que o custo de ter líderes populistas seja administrável. Mas, como ilustrad… https://t.co/BRGV3V57zu",10,,False
1357313090581364745,2021-02-04 13:00:33,"#AcessoLivre  | Taxa de eficácia pode ser maior se aplicação entre as duas doses for mais espaçada, diz universidad… https://t.co/F43TAOVOCw",6,,False
1357298097903255553,2021-02-04 12:00:58,Novos presidentes da Câmara e do Senado dão sinais favoráveis às pautas defendidas pelo ministro da Economia. O ‘Ne… https://t.co/2Zx9M31P5u,6,,False
1357283011662925825,2021-02-04 11:01:01,"PSL escolhe Bia Kicis, negacionista científica investigada pelo Supremo, para presidir comissão mais importante da… https://t.co/Us5xMPaNCz",100,,False
1357131909046939649,2021-02-04 01:00:36,Governo registra deficit recorde em 2020. Dívida pública dispara em meio às medidas de combate à pandemia. https://t.co/OByP0HFH1D,15,,False
1357124472147484673,2021-02-04 00:31:02,@nexopoliticas | Esta pesquisa de Andrea Larissa Boesing investiga como o desmatamento da Mata Atlântica influencia… https://t.co/HPohFKaLVh,6,nexopoliticas,False
1357116997402828800,2021-02-04 00:01:20,"#NexoArquivo | [explicado] O ‘Nexo’ explica como surgiram as agremiações, de que forma elas se profissionalizaram,… https://t.co/2lQxG3fqDd",21,,False
1357109222538964998,2021-02-03 23:30:27,"Mais de cinco décadas depois, gravadora lança canção lírica que foi encomendada por diretor a publicitário que era… https://t.co/pbwUfzID0g",30,,False
1357102016741449731,2021-02-03 23:01:49,[gráfico] O ‘Nexo’ apresenta a história de três compositoras que foram importantes para o desenvolvimento do gênero… https://t.co/3jLN2krRA8,30,,False
1357094732321722368,2021-02-03 22:32:52,"RT @gamarevista: Aplicativos prometem reunir diversas funções para “resolver a vida” do usuário. Entre eles, @RappiBrasil e @magazineluiza.…",0,,False
1357086674442977286,2021-02-03 22:00:51,Instalação de pedras para impedir permanência de pessoas em situação de rua debaixo de viaduto em São Paulo foi alv… https://t.co/efNjDjHKN6,65,,False
1357085171925794817,2021-02-03 21:54:53,"Inscreva-se na nossa newsletter diária noturna #DurmaComEssa, que além do podcast, traz os principais destaques do… https://t.co/SRvCRY0AfY",2,NexoJornal,False
1357085170290077697,2021-02-03 21:54:52,Este #NexoGráfico mostra a evolução de óbitos em decorrência da covid-19 confirmados no mundo até esta quarta-feira… https://t.co/TmT8qVrdMA,5,NexoJornal,False
1357085166590701568,2021-02-03 21:54:51,Este #NexoGráfico mostra a evolução de óbitos em decorrência da covid-19 confirmados no Brasil até esta quarta-feir… https://t.co/XD42qkr3eD,19,,False
1357084451113734145,2021-02-03 21:52:01,"Na próxima terça-feira (09), às 17h, acontece mais um ""Diálogos Contemporâneos"" - série do 11º #CongressoGIFE com… https://t.co/zfucE2HZ7E",3,,False
1357079193243254788,2021-02-03 21:31:07,"[podcast] Força-tarefa da cidade em que operação começou é encerrada, num momento de declínio do modelo e expectati… https://t.co/PD5RRpsskt",19,,False
1357071817073115146,2021-02-03 21:01:49,"Sistema financeiro aberto será implementado no país em quatro fases, com a promessa de oferecer produtos e serviços… https://t.co/9FJlGh0J5u",13,,False
1357063939100655616,2021-02-03 20:30:30,"Via @gamarevista | Prática e matadora, a raquete mata-mosquitos eletrificada é presença certa em casas de praia e v… https://t.co/bTsuVcw5fW",13,,False
1357058999871504386,2021-02-03 20:10:53,@taliifreitas Oi. Abrimos temporariamente todos os conteúdos exclusivos para assinante como forma de conhecer o jor… https://t.co/kK7ZGpTQVc,0,taliifreitas,False
1357050198804094978,2021-02-03 19:35:54,"@p_i_e_r_0 Oi, obrigado pela mensagem. A assinatura foi o modelo que escolhemos para financiar o nosso jornalismo c… https://t.co/bnsYlMFngx",0,p_i_e_r_0,False
1357048871122313216,2021-02-03 19:30:38,"Depois de escapar de envenenamento, principal adversário de Putin é mandado para colônia penal para cumprir mais de… https://t.co/9dZ7FRj1pS",15,,False
1357035725728976896,2021-02-03 18:38:24,"Embates entre ator e cantora acenderam sinal vermelho no público, que acusou o programa de ser conivente com tortur… https://t.co/QWOkwkDww3",40,,False
1357025608161759232,2021-02-03 17:58:11,@pameletelet Olá. Você está enfrentando algum problema? Nos envie uma mensagem privada,1,pameletelet,False
1357021293615452165,2021-02-03 17:41:03,Instalação de pedras para impedir permanência de pessoas em situação de rua debaixo de viaduto em São Paulo foi alv… https://t.co/uglrfN7EKH,59,,False
1357015162570608640,2021-02-03 17:16:41,RT @nexopoliticas: Esta pesquisa de Andrea Larissa Boesing investiga como o desmatamento da Mata Atlântica influencia o controle de pragas…,0,,False
1357003809546006532,2021-02-03 16:31:34,Governo registra deficit recorde em 2020. Dívida pública dispara em meio às medidas de combate à pandemia. https://t.co/9XZvQCVaDu,11,,False
1356988555025928194,2021-02-03 15:30:57,"#NexoArquivo | [explicado] O ‘Nexo’ explica como surgiram as agremiações, de que forma elas se profissionalizaram,… https://t.co/bpvbPl5bjS",64,,False
1356973488607748103,2021-02-03 14:31:05,"[opinião] ‘Delegar a máquinas a decisão sobre quem deve morrer ou sobreviver produz uma série de desafios morais, o… https://t.co/WHbJKKB6Lt",57,,False
1356950741571764228,2021-02-03 13:00:42,"Vazamento de 223 milhões de CPFs, além de outras informações, pode resultar em onda de golpes. Especialistas em seg… https://t.co/ffscWqutc9",40,,False
1356935644287799297,2021-02-03 12:00:42,Ministros do tribunal analisam caso sobre veiculação de programa de TV. Resultado pode orientar Justiça brasileira… https://t.co/WNxYFcoIuW,17,,False
1356920755703984130,2021-02-03 11:01:33,#AcessoLivre | Eficácia dos imunizantes da Novavax e da Janssen foi menor contra cepa da África do Sul. Empresas te… https://t.co/0m996DHVtX,18,,False
1356769515820957698,2021-02-03 01:00:34,"Prêmio Nobel da Paz que passou 15 anos em prisão domiciliar sofre nova detenção, em manobra militar que interrompe… https://t.co/FHEOnNNc8O",56,,False
1356762086311886848,2021-02-03 00:31:03,"Via @gamarevista | Apesar de ser alternativa menos eficiente no combate à covid-19, máscara de pano é o que resta à… https://t.co/m8AT3fKIVf",28,,False
1356754390338666497,2021-02-03 00:00:28,"#AcessoLivre | Nos 15 primeiros dias de vacinação em janeiro, país só alcançou 0,9% da população. No ritmo atual, 1… https://t.co/Cn8MF4HUc3",2,,False
1356754055243137024,2021-02-02 23:59:08,"RT @gamarevista: Apesar de ser alternativa menos eficiente no combate à #covid19, máscara de pano é o que resta à população
https://t.co/b8…",0,,False
1356746991162847240,2021-02-02 23:31:04,"Aluguéis de longo prazo aparecem como opção para quem quer ter um automóvel disponível, mas não deseja comprar um. https://t.co/qJn4MvFntz",18,,False
1356739297236430850,2021-02-02 23:00:30,"Lançado em 1988 no Brasil, ‘Um príncipe em Nova York’ tem recomendação etária revista após denúncia. https://t.co/MXxAPZ6mpt",12,,False
1356733969270718464,2021-02-02 22:39:19,"Material explica limite de licenças, formas de proteção de autor e obra e onde encontrar acervo público de vídeos,… https://t.co/o11GAKaaZH",32,,False
1356733150613934080,2021-02-02 22:36:04,"Inscreva-se na nossa newsletter diária noturna #DurmaComEssa, que além do podcast, traz os principais destaques do… https://t.co/kl4DMF0lFM",2,NexoJornal,False
1356733149015928843,2021-02-02 22:36:04,Este #NexoGráfico mostra a evolução de óbitos em decorrência da covid-19 confirmados no mundo até esta terça-feira… https://t.co/J6AR8TZqxE,9,NexoJornal,False
1356733145236856832,2021-02-02 22:36:03,Este #NexoGráfico mostra a evolução de óbitos em decorrência da covid-19 confirmados no Brasil até esta terça-feira… https://t.co/AHjKyxuaQD,22,,False
1356724197599412226,2021-02-02 22:00:30,"#NexoPP | ""Em 2020, imprensa pautou o tema como manifestação do racismo no país. Assunto demandou de intelectuais n… https://t.co/5IVRW5kDdU",10,,False
1356721884918915073,2021-02-02 21:51:18,[podcast] Dados de desempenho da Sputnik V contra a covid-19 foram publicados. Anvisa afirma que ainda não recebeu… https://t.co/8N1FfRF1RM,29,,False
1356710442425532421,2021-02-02 21:05:50,"RT @nexopoliticas: Para além da visão generalizante, trata-se de um público heterogêneo que demanda integração de políticas. Veja 10 pergun…",0,,False
1356709183878553600,2021-02-02 21:00:50,#AcessoLivre | Cidade enfrenta segunda onda de contágio pelo coronavírus e colapso do sistema médico. https://t.co/F4iLz2C10p,11,,False
1356705475027468289,2021-02-02 20:46:06,"RT @gamarevista: Fácil, prática e matadora, a raquete eletrificada é presença certa em casas de praia e veraneio. Conheça mais sobre o #Obj…",0,,False
1356701794173394949,2021-02-02 20:31:28,#NexoArquivo | Mário Schenberg é o oitavo personagem da série ‘#CientistasDoBrasil que você precisa conhecer’. Astr… https://t.co/3UYQQM2TzO,25,,False
1356695568026853379,2021-02-02 20:06:44,#AcessoLivre | Governo estadual endurece medidas de isolamento social e donos de estabelecimentos protestam. Especi… https://t.co/YDCIsOrEYs,6,,False
1356689200792428547,2021-02-02 19:41:26,[gráfico] O ‘Nexo’ apresenta a história de três compositoras que foram importantes para o desenvolvimento do gênero… https://t.co/Iq6k4LSLuT,41,,False
1356673976148312064,2021-02-02 18:40:56,"#AcessoLivre | A 171 dias da Olimpíada, país pretende imunizar cerca de 40 milhões de habitantes até fins de março… https://t.co/bVOX6ZpBmL",14,,False
1356667528270000133,2021-02-02 18:15:19,"[opinião] ‘Temos 39,2 milhões de pessoas sem acesso à água potável. 48% dos nossos compatriotas não têm sequer cole… https://t.co/l3MyTwBpES",52,,False
1356647716365959168,2021-02-02 16:56:35,"RT @nexopoliticas: Neste vídeo, a pesquisadora @NerisNati explica como o movimento negro contribuiu com a Constituinte de 1988. Um conteúdo…",0,,False
1356644505785667586,2021-02-02 16:43:50,"#AcessoLivre | Portugal tornou-se em janeiro o país que tem, proporcionalmente, o maior número de infectados pela c… https://t.co/m02HNCyStt",31,,False
1356626041612173314,2021-02-02 15:30:27,"Via @gamarevista | Em tempos pandêmicos, ela se mostrou o melhor guia para a tomada de decisões e capaz de nos gara… https://t.co/cDbc8xGGjo",12,,False
1356611007267880960,2021-02-02 14:30:43,"Colegiado entrou no centro do embate político em Brasília após o novo presidente da Casa, Arthur Lira (PP-AL), anul… https://t.co/zdncWRLujS",11,,False
1356589809456865280,2021-02-02 13:06:29,"RT @nexopoliticas: O país já teve papel de destaque nas negociações internacionais do clima. Hoje em dia, no entanto, há preocupação com as…",0,,False
1356588339890118656,2021-02-02 13:00:39,"#AcessoLivre | Nos 15 primeiros dias de vacinação em janeiro, país só alcançou 0,9% da população. No ritmo atual, 1… https://t.co/aDeJdLLcwm",28,,False
1356573451050512390,2021-02-02 12:01:29,"Lançado em 1988 no Brasil, ‘Um príncipe em Nova York’ tem recomendação etária revista após denúncia; plataformas co… https://t.co/TcQ4q6RmdQ",10,,False
1356558151684939776,2021-02-02 11:00:41,"Apoiado pelo governo, deputado será o responsável por colocar a agenda do Planalto em pauta e analisar pedidos de i… https://t.co/owHAPz2d8z",16,,False
