id,created_at,text,likes,in reply to,retweeted
1369800401093095425,2021-03-11 00:00:39,"[estante] O ‘Nexo’ publica trecho de livro que reconta casos reais da história recente para ironizar a megalomania,… https://t.co/Fr6zXs3bdn",13,,False
1369795466834157576,2021-03-10 23:41:03,Projeto que tira o nome do jornalista de estádio foi aceito na Assembleia do Rio. https://t.co/L8g7QWz6jT,9,,False
1369789307750412300,2021-03-10 23:16:35,"Trump é um símbolo do hipercapialismo americano. Mas, na China comunista, estátuas do ex-presidente americano estão… https://t.co/UjcnF5aywm",24,,False
1369785346830069765,2021-03-10 23:00:50,"[opinião] ‘A ciência nos deu a maior lição da pandemia: tempos difíceis exigem trabalho sério, paciência e persistê… https://t.co/5RsHdwxBhF",11,,False
1369778825706360832,2021-03-10 22:34:55,"Inscreva-se na nossa newsletter diária noturna #DurmaComEssa, que além do podcast, traz os principais destaques do… https://t.co/ZLONcCjmw1",5,NexoJornal,False
1369778824054005760,2021-03-10 22:34:55,Este #NexoGráfico mostra a evolução de óbitos por covid-19 no mundo até esta quarta-feira (10). Foram 10.119 novas… https://t.co/Q25Nha8Uzv,8,NexoJornal,False
1369778820161695748,2021-03-10 22:34:54,Este #NexoGráfico mostra a evolução de óbitos por covid-19 no Brasil até esta quarta-feira (10). A média móvel foi… https://t.co/cA4kOzBXzk,29,,False
1369770167459266562,2021-03-10 22:00:31,Relator da Lava Jato anulou condenações de ex-presidente. O‘Nexo’ ouviu cientistas políticos sobre o impacto da vol… https://t.co/Zq4BPDKJ4A,21,,False
1369765630832939020,2021-03-10 21:42:30,[podcast] Procurador-geral de Justiça do estado cobra fechamento de templos religiosos e paralisação de eventos esp… https://t.co/ggmzKBjZwQ,13,,False
1369755066257842177,2021-03-10 21:00:31,[gráfico] Países europeus apresentam os maiores índices de consumo per capita. China e Indonésia são as maiores con… https://t.co/A9AAIvf9sz,10,,False
1369749040649416709,2021-03-10 20:36:34,"Responsabilidade pela reforma do espaço, que já foi 50% concluída, é contestada por governo federal e estadual de S… https://t.co/y41O5P7mcS",10,,False
1369748470190505993,2021-03-10 20:34:18,RT @gamarevista: 100 contos que representam diferentes idades da vida. A escritora Olivia Byington apresenta com exclusividade na Gama uma…,0,,False
1369747016927023106,2021-03-10 20:28:32,"A primeira mesa “A velha e a nova revolta da vacina” acontece na terça-feira, dia 16 de março, entre 17h e 18h30, e… https://t.co/9eSq1jFtdb",108,NexoJornal,False
1369740089333608456,2021-03-10 20:01:00,Estudo americano mostra que 2020 foi um dos piores anos para as mulheres da indústria fonográfica. https://t.co/O4ZsVcJ8xZ,12,,False
1369739092766887937,2021-03-10 19:57:02,Em parceria com a @ANPOCS promovemos entre março e junho o festival #QuandoComeçaOSéculo21? Encontros virtuais entr… https://t.co/b40mk3XnPf,32,,False
1369737485610287110,2021-03-10 19:50:39,"@cubalanssa No momento não temos uma assinatura para estudantes, mas você pode conhecer os nossos planos acessando… https://t.co/uUOGNtz8D4",0,cubalanssa,False
1369736052265586691,2021-03-10 19:44:57,"Em primeiro pronunciamento após anulação de condenações, ex-presidente se contrapõe a Bolsonaro e adota tom moderad… https://t.co/2qVL6oPTw7",50,,False
1369724286102106117,2021-03-10 18:58:12,"RT @ANPOCS: Em parceria com o @NexoJornal, vamos promover entre março e junho o festival #QuandoComeçaOSéculo21?.

Convidamos cientistas so…",0,,False
1369719815292792835,2021-03-10 18:40:26,"#NexoPolíticasPúblicas | Neste vídeo, o doutor em sociologia, Paulo César Ramos, pesquisador do Afro-@cebrap, expli… https://t.co/C1dVkr1ZQE",6,,False
1369716322301579270,2021-03-10 18:26:33,"RT @nexopoliticas: Desde 2019, ao menos 15 nomeações para reitorias federais não seguiram a escolha do primeiro colocado pela comunidade ac…",0,,False
1369716199580459008,2021-03-10 18:26:04,"RT @gamarevista: @gestupidas, @BertJoi , @GabrielaPrioli, @TeresaCristina. Elas e outras mulheres mandam vídeos para a Gama em que demarcam…",0,,False
1369702216597143557,2021-03-10 17:30:30,"[entrevista] Canadense Robert Muggah, diretor do Instituto Igarapé, fala ao 'Nexo' sobre como secas, inundações e o… https://t.co/D4PpMiokbe",12,,False
1369687158802546688,2021-03-10 16:30:40,#AcessoLivre | Órgão americano de saúde liberou pessoas completamente imunizadas para atividades como encontros sem… https://t.co/7YOvaLYncE,5,,False
1369671978248994831,2021-03-10 15:30:21,"#NexoArquivo | Publicada em 1958, obra satírica foi escrita por um personagem importante do Partido Trabalhista bri… https://t.co/tKsBNVEeK7",19,,False
1369656948119994369,2021-03-10 14:30:38,"[opinião] ‘O país que circula no WhatsApp nada tem a ver com o país que vemos nos jornais. Para o bem e para o mal,… https://t.co/q6HgpIS2JC",29,,False
1369634359653892096,2021-03-10 13:00:52,Mercado reage após decisão que tornou Lula elegível. O ‘Nexo’ falou com especialistas para entender por que a reaçã… https://t.co/5vUNLJ38o9,7,,False
1369619146460307462,2021-03-10 12:00:25,"#AcessoLivre | Às vésperas da pandemia completar um ano, país assiste a uma escalada de óbitos, com capacidade de l… https://t.co/kyUBWcKtuT",12,,False
1369604084798488578,2021-03-10 11:00:34,"Após anulação das condenações de Lula, análise da atuação de ex-juiz da Lava Jato no caso tríplex é retomada e acab… https://t.co/i9Lzz6Nvk8",19,,False
1369453012771606528,2021-03-10 01:00:16,#AcessoLivre | Decreto que permitiu eventos religiosos no pior momento da pandemia contrariou cientistas que assess… https://t.co/h8BVCPtEuH,64,,False
1369445577012969472,2021-03-10 00:30:43,"Via @gamarevista | Estudiosos do tema avaliam os problemas, benefícios e a relevância do chamado homeschooling, cuj… https://t.co/pR7ZnzoY1L",10,,False
1369438037076303873,2021-03-10 00:00:45,Projeto traz verbetes que contam as origens de palavras usadas rotineiramente no universo da tecnologia. https://t.co/8KqnneVxd9,38,,False
1369436852571303944,2021-03-09 23:56:03,"RT @gamarevista: Estudiosos do tema avaliam os problemas, benefícios e a relevância do chamado #homeschooling, cuja aprovação está na mira…",0,,False
1369430508925550608,2021-03-09 23:30:50,Estudo americano mostra que 2020 foi um dos piores anos para as mulheres da indústria fonográfica. https://t.co/qJ98p9QWmf,16,,False
1369423013725224965,2021-03-09 23:01:03,"[opinião] ‘O país exige a proliferação de gênios nas periferias, mas, ao ser confrontado com o fracasso de tal post… https://t.co/RwiqJCHzTD",7,,False
1369420081692876802,2021-03-09 22:49:24,"Ativo financeiro digital é usado para dar lastro a obras de arte virtuais, vídeos e até memes. https://t.co/33qKQmhwRG",29,,False
1369415004794068995,2021-03-09 22:29:14,"Inscreva-se na nossa newsletter diária noturna #DurmaComEssa, que além do podcast, traz os principais destaques do… https://t.co/bMjjg9wpka",3,NexoJornal,False
1369415003103715328,2021-03-09 22:29:13,Este #NexoGráfico mostra a evolução de óbitos por covid-19 no mundo até esta terça-feira (09). Foram 6.836 novas mo… https://t.co/aKhaehnB4x,3,NexoJornal,False
1369414999354077185,2021-03-09 22:29:13,Este #NexoGráfico mostra a evolução de óbitos por covid-19 no Brasil até esta terça-feira (09). A média móvel foi d… https://t.co/JrYTljdrY0,34,,False
1369407956949889034,2021-03-09 22:01:13,#AcessoLivre | Líderes estaduais articulam pacto nacional para anunciar medidas conjuntas de isolamento social e co… https://t.co/MkEGSXIbWn,11,,False
1369400170245414913,2021-03-09 21:30:17,[gráfico] Países europeus apresentam os maiores índices de consumo per capita. China e Indonésia são as maiores con… https://t.co/s296sbbBgH,9,,False
1369394737795510286,2021-03-09 21:08:42,"RT @nexopoliticas: Neste vídeo, o doutor em sociologia Paulo César Ramos, pesquisador do Afro-@cebrap, explica por que falar em genocídio d…",0,,False
1369394724709273600,2021-03-09 21:08:39,RT @gamarevista: Esse #ObjetoDeAnálise_Gama é a versão retrô das notas de celular e configurou entre os cinco itens de escritório mais vend…,0,,False
1369392874673029137,2021-03-09 21:01:18,"[opinião] ‘Comparar as táticas de Bolsonaro às de Mussolini é algo tentador. O atual governo é autoritário, mas não… https://t.co/3aIWCdFb1t",13,,False
1369392662219026434,2021-03-09 21:00:27,"[podcast] Com Lula de volta ao jogo eleitoral, crescem as chances de 2022 reproduzir 2018, num momento em que polít… https://t.co/dtovYAYQqf",7,,False
1369377712700338179,2021-03-09 20:01:03,"Com contratos firmados com Netflix e Spotify, casal se transformou em uma marca selada após entrevista a Oprah Winf… https://t.co/dHAzv7zTUB",28,,False
1369370276232900608,2021-03-09 19:31:30,#NexoArquivo | Nem sempre um sistema de recompensa apenas por esforço individual garante oportunidades iguais para… https://t.co/cewFV7iYkt,24,,False
1369360984595431433,2021-03-09 18:54:34,"RT @negrobelchior: Iniciativa super valorosa do @NexoJornal  
Bora fazer chegar à negrada que sonha trabalhar com comunicação.

https://t.c…",0,,False
1369360858279739394,2021-03-09 18:54:04,"RT @winniebueno: Programa Diversidade Racial na Comunicação Nexo é um projeto de formação voltado para negras, negres e negros estudantes d…",0,,False
1369355109977763846,2021-03-09 18:31:14,Preço do barril já supera o patamar do início de 2020. O ‘Nexo’ mostrou como a commodity se recuperou de crise hist… https://t.co/oGGgvuarWQ,9,,False
1369350227979866118,2021-03-09 18:11:50,"RT @nexopoliticas: ""Projeto em escolas públicas do Rio debateu ancestralidade e identidade com alunas negras. Iniciativa usou como exemplo…",0,,False
1369348331965648902,2021-03-09 18:04:18,"Em países como Argentina, Venezuela, Bolívia e Equador, líderes de esquerda saúdam decisão do Supremo sobre Lula e… https://t.co/SP3mjmzHKg",32,,False
1369324912498901004,2021-03-09 16:31:14,Jornal abre inscrições nesta terça (9) para formação voltada a estudantes negros de todo o Brasil. Projeto tem dura… https://t.co/gFV4wctwS8,24,,False
1369316211566260229,2021-03-09 15:56:40,"RT @yasminsmp: 📢 Atenção, estudantes de jornalismo!
O @NexoJornal abre inscrições para formação voltada a estudantes negros de todo o Brasi…",0,,False
1369315240803004425,2021-03-09 15:52:48,As inscrições para o programa de #DiversidadeRacial na Comunicação podem ser feitas até 23 de março. Preencha o for… https://t.co/SWmHyEwUK1,7,NexoJornal,False
1369315239435640833,2021-03-09 15:52:48,"Os estudantes receberão uma bolsa mensal, uma assinatura anual do jornal, certificado de participação e a publicaçã… https://t.co/XMbolxG2Wi",6,NexoJornal,False
1369315238244401162,2021-03-09 15:52:48,As atividades serão realizadas remotamente e pessoas de todos os estados brasileiros poderão participar do programa. (4/6),3,NexoJornal,False
1369315236944216066,2021-03-09 15:52:47,"Durante a imersão, o grupo de estudantes terá três encontros semanais, com duração de quatro horas cada. É necessár… https://t.co/w7BTFhT046",7,NexoJornal,False
1369315235673346052,2021-03-09 15:52:47,São dez bolsas para pessoas negras que queiram complementar sua formação em uma imersão de dez meses. Algumas das a… https://t.co/QBdYUnXZGQ,6,NexoJornal,False
1369315234285051910,2021-03-09 15:52:47,"Para incentivar a equidade racial nas organizações de comunicação brasileiras, lançamos hoje o Programa… https://t.co/Fry8NeGqJN",78,,False
1369309783271108608,2021-03-09 15:31:07,"#NexoArquivo | [vídeo] Atriz, dramaturga e diretora fala ao ‘Nexo’ sobre o teatro, os ataques do governo à cultura,… https://t.co/P9NwIRqBS9",20,,False
1369294717729570823,2021-03-09 14:31:15,#ACessoLivre  | Decreto que permitiu eventos religiosos no pior momento da pandemia contrariou cientistas que asses… https://t.co/LlV1quikMm,27,,False
1369279549251403777,2021-03-09 13:30:59,Relator da Lava Jato anulou condenações de ex-presidente. O‘Nexo’ ouviu cientistas políticos sobre o impacto da vol… https://t.co/BhPwZysdS7,14,,False
1369256770607144964,2021-03-09 12:00:28,"[opinião] ‘O negacionismo pode ser atraente: ele simplifica o sentido da vida, nos desobriga de um compromisso com… https://t.co/Znoc7JWW0V",44,,False
1369241636132290561,2021-03-09 11:00:19,"Ao anular condenações de Lula, Fachin extinguiu pedido do petista que acusava ex-juiz de parcialidade, mas caso ain… https://t.co/wsaV4EAyUg",26,,False
1369090924110897154,2021-03-09 01:01:27,#AcessoLivre | Perfis nas redes sociais ensinam sobre a eficácia de cada tipo de equipamento e divulgam promoções d… https://t.co/GGJg65Bpvd,46,,False
1369083388540370944,2021-03-09 00:31:30,Arquiteta ítalo-brasileira que morreu em 1992 receberá Leão de Ouro em maio de 2021 pelo conjunto da obra. https://t.co/y03VMviucN,51,,False
1369078722603712514,2021-03-09 00:12:58,"[explicado] Marcado pela pluralidade de pautas, movimento por direitos das mulheres segue em constante transformaçã… https://t.co/P69japCVhb",8,NexoJornal,False
1369078721173422081,2021-03-09 00:12:58,"[entrevista] Neste episódio do podcast Cientistas do Brasil que você precisa conhecer, a bióloga Rosy Isaias fala s… https://t.co/2vyvWcWvNE",7,NexoJornal,False
1369078719722192896,2021-03-09 00:12:57,"[entrevista] Neste episódio do podcast Cientistas do Brasil que você precisa conhecer, a bióloga Mercedes Bustamant… https://t.co/brapNFoqE8",0,NexoJornal,False
1369078718291972097,2021-03-09 00:12:57,[entrevista] A astrofísica Thaisa Bergmann fala sobre o papel dos buracos negros na evolução do universo e dá dicas… https://t.co/IqFiNIAG6t,0,NexoJornal,False
1369078716916195330,2021-03-09 00:12:57,"[entrevista] Neste episódio do podcast Cientistas do Brasil que você precisa conhecer, a física Sônia Guimarães fal… https://t.co/xC2AocdQ5l",0,NexoJornal,False
1369078715527929859,2021-03-09 00:12:56,[especial] O Nexo apresenta uma breve biografia ilustrada de três mulheres que foram protagonistas na história do s… https://t.co/7GKPCzxMOc,1,NexoJornal,False
1369078714135420933,2021-03-09 00:12:56,"[especial] O Nexo apresenta o legado de cinco personagens históricas que tiveram papel decisivo na política, na cul… https://t.co/DUXPY9YvWN",3,NexoJornal,False
1369078712948436994,2021-03-09 00:12:56,"No #DiaDasMulheres resgatamos conteúdos da história de luta, desafios e conquistas das mulheres no Brasil e no mundo. Segue o fio 🧵",11,,False
1369075767536189447,2021-03-09 00:01:13,Plataforma lançada em 2020 reúne centenas de milhares de imagens retiradas de longas de todo o mundo. https://t.co/ZhuM2YmJyJ,47,,False
1369068052139159554,2021-03-08 23:30:34,"Com contratos firmados com Netflix e Spotify, casal se transformou em uma marca selada após entrevista a Oprah Winf… https://t.co/PC7Ok0sMd9",39,,False
1369060573636407297,2021-03-08 23:00:51,O ‘Nexo’ entrevista a professora de antropologia da USP Heloisa Buarque de Holanda sobre os impactos da crise de sa… https://t.co/jb45KqHmkd,19,,False
1369055337286950914,2021-03-08 22:40:02,"@mobixinho Aqui, @mobixinho : https://t.co/ziOCAZsgnn",3,mobixinho,False
1369055095216816131,2021-03-08 22:39:05,[podcast] Bolsonaro participa de reunião com Pfizer para comprar vacina enquanto Fiocruz e Butantan tentam viabiliz… https://t.co/KyPTClRUuA,12,,False
1369049413503627265,2021-03-08 22:16:30,"Inscreva-se na nossa newsletter diária noturna #DurmaComEssa, que além do podcast, traz os principais destaques do… https://t.co/RPQWMqyaJb",3,NexoJornal,False
1369049411741974528,2021-03-08 22:16:30,Este #NexoGráfico mostra a evolução de óbitos por covid-19 no mundo até esta segunda-feira (08). Foram 5.243 novas… https://t.co/MKIlocj53k,11,NexoJornal,False
1369049407996502026,2021-03-08 22:16:29,Este #NexoGráfico mostra a evolução de óbitos por covid-19 no Brasil até esta segunda-feira (08). A média móvel foi… https://t.co/75aAiH89ie,92,,False
1369045598066929664,2021-03-08 22:01:20,Setor tem queda de quase 10% entre 2011 e 2020. O ‘Nexo’ reuniu os principais números que detalham a retração indus… https://t.co/cBps5jxY7u,11,,False
1369043040359358471,2021-03-08 21:51:11,RT @nexopoliticas: Estudo publicado na Public Health Nutrition avalia como a pandemia afetou a insegurança alimentar e a saúde mental mater…,0,,False
1369037861916454917,2021-03-08 21:30:36,"Bolsonaro despacha comitiva a Israel, país onde, ao contrário do Brasil, a vacinação avança, o lockdown funciona e… https://t.co/Zr7KKGeFpl",44,,False
1369030233668648966,2021-03-08 21:00:17,"[entrevista] Após medidas de órgãos federais para inibir manifestações políticas de acadêmicos, Marcelo Knobel, rei… https://t.co/0ANa19zsqs",12,,False
1369029684386799618,2021-03-08 20:58:06,"Relator da Lava Jato no Supremo torna ex-presidente novamente elegível. Com a decisão, suspeição de Moro não será m… https://t.co/OrdUpBzWOc",29,,False
1369015245101010945,2021-03-08 20:00:44,#AcessoLivre | Preocupação com descontrole da covid-19 e surgimento de novas cepas aparece na imprensa e em declara… https://t.co/7dx7tfuf1E,16,,False
1369000232407740421,2021-03-08 19:01:04,Russo Ruslan Mellin documenta as histórias de abusos vividas por suas pacientes por meio de retratos de seus ferime… https://t.co/Zn6BiNorQD,5,,False
1368985160092356619,2021-03-08 18:01:11,"Além de clássicos de seu acervo, a Paramount+ promete novas leituras de títulos antigos, como ""Star Trek"" e ""Grease… https://t.co/7V6QynWPbF",11,,False
1368977637398478854,2021-03-08 17:31:17,#AcessoLivre | Líderes estaduais articulam pacto nacional para anunciar medidas conjuntas de isolamento social e co… https://t.co/BWb1WIlGFn,21,,False
1368975648904142853,2021-03-08 17:23:23,"RT @nexopoliticas: ""A discussão da pandemia e, sobretudo, a discussão da vacinação são, antes de qualquer coisa, assuntos altamente técnico…",0,,False
1368970121453142018,2021-03-08 17:01:25,Observatório da Universidade de Harvard inaugurou em 1881 o grupo de astrônomas que por 40 anos se dedicaria a estu… https://t.co/BWxdtZkD53,31,,False
1368966177486176258,2021-03-08 16:45:45,"RT @gamarevista: ⚡️@GabrielaPrioli, @gestupidas, @BertJoi,@TeresaCristina e outras dizem a Gama o que falta para as mulheres conquistarem e…",0,,False
1368963313581895680,2021-03-08 16:34:22,"#AcessoLivre | Por três dias seguidos, manifestantes saem às ruas de Assunção pedindo renúncia do presidente, acusa… https://t.co/I3QcZR8C6n",17,,False
1368946829270937609,2021-03-08 15:28:52,@LemosI Lamentamos sua experiência. Você pode entrar em contato com info@nexojornal.com.br contando a URL da página… https://t.co/sjZ4WgbScE,0,LemosI,False
1368932353154940929,2021-03-08 14:31:21,"[opinião] ‘Comparar as táticas de Bolsonaro às de Mussolini é algo tentador. O atual governo é autoritário, mas não… https://t.co/KoNIrPw0re",26,,False
1368919772881096707,2021-03-08 13:41:21,"RT @gamarevista: @GabrielaPrioli, @gestupidas, @TeresaCristina e outras dizem a Gama o que falta para as mulheres conquistarem e manterem s…",0,,False
1368909456264859649,2021-03-08 13:00:22,Setor tem queda de quase 10% entre 2011 e 2020. O ‘Nexo’ reuniu os principais números que detalham a retração indus… https://t.co/xaYXOHcZtW,6,,False
1368894488719024140,2021-03-08 12:00:53,O ‘Nexo’ entrevista a professora de antropologia da USP Heloisa Buarque de Holanda sobre os impactos da crise de sa… https://t.co/xmGSGKHhVt,27,,False
1368879429641003009,2021-03-08 11:01:03,"Senado aprova em dois turnos a PEC Emergencial, que traz as bases para a nova rodada do benefício. Saiba o que falt… https://t.co/J3xq2LE3zX",6,,False
1368720935340146692,2021-03-08 00:31:15,#NexoPolíticasPúblicas | O que são serviços ecossistêmicos? Como eles influenciam a oferta de água e de alimentos?… https://t.co/cDHcn1NXBP,24,,False
1368705644946161670,2021-03-07 23:30:29,"Além de clássicos de seu acervo, a Paramount+ promete novas leituras de títulos antigos, como ""Star Trek"" e ""Grease… https://t.co/4yb9dyxOAC",14,,False
1368683185677213698,2021-03-07 22:01:15,"[estante] Ireuda Silva, vereadora de Salvador, estreia em 13 de março como nova colunista do ‘Nexo’, no espaço de o… https://t.co/xyqP6BosAI",38,,False
1368667994247868424,2021-03-07 21:00:53,"Aos finais de semana, recuperamos em nossas redes sociais as #MaisLidasNoNexo entre os assinantes. Este conteúdo es… https://t.co/jsITTmbzGu",6,,False
1368652792915714051,2021-03-07 20:00:28,Observatório da Universidade de Harvard inaugurou em 1881 o grupo de astrônomas que por 40 anos se dedicaria a estu… https://t.co/pyxOryNqxw,64,,False
1368637865425526795,2021-03-07 19:01:09,"Via @gamarevista | Gabriela Priolli, Joice Berth, Camila Coutinho e outras dizem a Gama o que falta para as mulhere… https://t.co/WyAixWbKT3",16,,False
1368622627963760643,2021-03-07 18:00:36,[opinião] ‘O caso Cury faz ecoar outros casos: os deputados se protegem entre si e mandam para a sociedade o recado… https://t.co/gDVcYmfOle,32,,False
1368607615413010432,2021-03-07 17:00:57,"Aos finais de semana, recuperamos em nossas redes sociais as #MaisLidasNoNexo entre os assinantes. Este conteúdo es… https://t.co/d2HobxsbDf",9,,False
1368592378173460486,2021-03-07 16:00:24,"Contra postagens políticas no Twitter, policiais e parlamentares tentam usar decisão do Supremo Tribunal Federal co… https://t.co/SQg3HoYB2e",22,,False
1368577443246800899,2021-03-07 15:01:04,"#NexoArquivo | [especial] Na economia, estudos tentam calcular o valor produtivo e estatístico que se perde quando… https://t.co/lJJ0DYw0V3",15,,False
1368562265063124992,2021-03-07 14:00:45,"[opinião] ‘O país exige a proliferação de gênios nas periferias, mas, ao ser confrontado com o fracasso de tal post… https://t.co/Nf4mYmk06s",15,,False
1368539600042524675,2021-03-07 12:30:41,#AcessoLivre | Preocupação com descontrole da covid-19 e surgimento de novas cepas aparece na imprensa e em declara… https://t.co/2M1UBpBKJJ,42,,False
1368524710368186375,2021-03-07 11:31:31,"Aos finais de semana, recuperamos em nossas redes sociais as #MaisLidasNoNexo entre os assinantes. Este conteúdo es… https://t.co/kF9f3XgCWP",28,,False
1368358328858972160,2021-03-07 00:30:23,"[especial] Fruto da luta pela redemocratização no Brasil, maior sistema público de saúde do mundo enfrenta estagnaç… https://t.co/bovMTzPIaf",63,,False
1368343280472256517,2021-03-06 23:30:35,"App para textos em inglês corta advérbios, enxuga frases e contorna a voz passiva, emulando o estilo claro e objeti… https://t.co/MDz9YFVjjp",42,,False
1368320619553714181,2021-03-06 22:00:32,Russo Ruslan Mellin documenta as histórias de abusos vividas por suas pacientes por meio de retratos de seus ferime… https://t.co/L8EEGuuQlx,9,,False
1368305508864700424,2021-03-06 21:00:29,"#NexoPolíticasPúblicas | Estudo produzido por pesquisadores do @Imaflora, do @socioambiental e da @ARTIGO19 aponta… https://t.co/jaGn7swvJx",10,,False
1368290582628597763,2021-03-06 20:01:11,"[opinião] ‘A ciência nos deu a maior lição da pandemia: tempos difíceis exigem trabalho sério, paciência e persistê… https://t.co/cxg0KzmDtV",26,,False
1368275432383119360,2021-03-06 19:00:59,"Aos finais de semana, recuperamos em nossas redes sociais as #MaisLidasNoNexo entre os assinantes. Este conteúdo es… https://t.co/2k234ffraq",15,,False
1368260492100333570,2021-03-06 18:01:37,"[entrevista] Após medidas de órgãos federais para inibir manifestações políticas de acadêmicos, Marcelo Knobel, rei… https://t.co/KHw8wfbOGX",34,,False
1368245265933688832,2021-03-06 17:01:06,"Via @gamarevista | O urbanista Roberto Andrés fala sobre sobre trânsito, pandemia o futuro da mobilidade nas cidades https://t.co/Xp8BljymKM",2,,False
1368230029495255042,2021-03-06 16:00:34,#AcessoLivre  | Secretaria da Cultura do governo Bolsonaro veta análise e aprovação de projetos em estados e municí… https://t.co/lUn2J0KniD,23,,False
1368214901718740997,2021-03-06 15:00:27,"#NexoArquivo | [vídeo] Entenda como nasceu o drinque feito à base de cachaça, como ele se tornou parte até da legis… https://t.co/0TJ2bnPLwP",15,,False
1368199933715693574,2021-03-06 14:00:58,#AcessoLivre  | Previsão do Ministério da Saúde é que o país alcance 3.000 mortes diárias pela covid-19 em duas sem… https://t.co/0V7yZ2CTGp,33,,False
1368177155658690565,2021-03-06 12:30:28,"#AcessoLivre  | Em semana de recordes de mortes diárias por covid-19, Bolsonaro cita ‘frescura’ e ‘mimimi’. O ‘Nexo… https://t.co/lXPybVyYvI",26,,False
1368162220404785152,2021-03-06 11:31:07,"Aos finais de semana, recuperamos em nossas redes sociais as #MaisLidasNoNexo entre os assinantes. Este conteúdo es… https://t.co/TaRcyB2xmb",26,,False
1368003525939200002,2021-03-06 01:00:31,"#NexoPolíticasPúblicas | Neste vídeo do CPTE (Centro de Pesquisa Transdisciplinar em Educação), a professora de quí… https://t.co/nwWcvNxCQw",6,,False
1368003521623293955,2021-03-06 01:00:30,O dia 5 de março de 2021 marca os 150 anos de nascimento da filósofa e ativista polonesa. https://t.co/hs72bW0dMS,59,,False
1367991348587020294,2021-03-06 00:12:08,"Inscreva-se na nossa newsletter diária noturna #DurmaComEssa, que além do podcast, traz os principais destaques do… https://t.co/6fu8BlJxax",1,NexoJornal,False
1367991346875805698,2021-03-06 00:12:07,Este #NexoGráfico mostra a evolução de óbitos em decorrência da covid-19 confirmados no mundo até esta sexta-feira… https://t.co/NToImePrnv,5,NexoJornal,False
